{
  "schema": "nexbench.run/2.1",
  "suite": {
    "name": "NEXBENCH",
    "version": "2.1",
    "totalTasks": 214,
    "trialsPerTask": 5
  },
  "agent": {
    "id": "fable5-react",
    "name": "Claude Fable 5 · ReAct-Web3",
    "scaffold": "ReAct-Web3 (reference)",
    "model": "claude-fable-5",
    "class": "agent",
    "openSource": true
  },
  "run": {
    "completedAt": "2026-07-02",
    "harnessVersion": "2.1.3",
    "harnessBuild": "sha256:8c1e6a0d3f4b2a97c5e18d640b9f2a7d31c8e5f0a6b4d2c9871e3f5a0b6c4d28",
    "envPinsDigest": "sha256:94e2a32324ffd00a57f02c4ff60ee50ad3f14892790cdf6d8b14190765d44cea"
  },
  "results": {
    "categories": {
      "execution": {
        "passAt1": 77.5
      },
      "swaps": {
        "passAt1": 73.5714
      },
      "bridging": {
        "passAt1": 64.1667
      },
      "defi": {
        "passAt1": 72.6667
      },
      "research": {
        "passAt1": 83.8462
      },
      "security": {
        "passAt1": 80
      },
      "analysis": {
        "passAt1": 81.5385
      },
      "governance": {
        "passAt1": 66
      }
    },
    "metrics": {
      "passHat5": 61.6822,
      "svrPer100": 0.9346,
      "gasOverspendPct": 2.1,
      "costPerTaskUsd": 2.14,
      "medianTaskSeconds": 178
    }
  },
  "submitter": {
    "name": "Nexis Research",
    "contact": "bench@nex-t1.ai",
    "github": "Nexis-AI"
  },
  "integrity": {
    "runId": "nbr1_a7816280a3063c21",
    "traceRoot": "sha256:239c13ee31f123a7a94f6e4b5fc3dc03823af146c39268c597b815fbdf989f1b",
    "canaryClean": true
  },
  "provenance": {
    "kind": "reference",
    "tier": "verified",
    "verifiedBy": "Nexis Research",
    "verifiedAt": "2026-07-02"
  }
}
