{
  "schema": "nexbench.run/2.1",
  "suite": {
    "name": "NEXBENCH",
    "version": "2.1",
    "totalTasks": 214,
    "trialsPerTask": 5
  },
  "agent": {
    "id": "human-expert",
    "name": "Human Expert Baseline",
    "scaffold": "n=6 professional operators",
    "model": "Human",
    "class": "human-baseline",
    "openSource": false
  },
  "run": {
    "completedAt": "2026-06-02",
    "harnessVersion": "2.1.3",
    "harnessBuild": "sha256:8c1e6a0d3f4b2a97c5e18d640b9f2a7d31c8e5f0a6b4d2c9871e3f5a0b6c4d28",
    "envPinsDigest": "sha256:94e2a32324ffd00a57f02c4ff60ee50ad3f14892790cdf6d8b14190765d44cea"
  },
  "results": {
    "categories": {
      "execution": {
        "passAt1": 96.25
      },
      "swaps": {
        "passAt1": 95
      },
      "bridging": {
        "passAt1": 90.8333
      },
      "defi": {
        "passAt1": 93.3333
      },
      "research": {
        "passAt1": 88.4615
      },
      "security": {
        "passAt1": 90.7143
      },
      "analysis": {
        "passAt1": 89.2308
      },
      "governance": {
        "passAt1": 92
      }
    },
    "metrics": {
      "passHat5": 89.2523,
      "svrPer100": 0.4673,
      "gasOverspendPct": 1.1,
      "costPerTaskUsd": 74.5,
      "medianTaskSeconds": 1260
    }
  },
  "submitter": {
    "name": "Nexis Research",
    "contact": "bench@nex-t1.ai",
    "github": "Nexis-AI"
  },
  "integrity": {
    "runId": "nbr1_c7343b00ba5a0834",
    "traceRoot": "sha256:47339e84eb0584115075fb90214e794d1370d8fb20a4abea9a3ebb526a89413f",
    "canaryClean": true
  },
  "provenance": {
    "kind": "reference",
    "tier": "verified",
    "verifiedBy": "Nexis Research",
    "verifiedAt": "2026-06-02"
  }
}
