{
  "schema": "nexbench.run/2.1",
  "suite": {
    "name": "NEXBENCH",
    "version": "2.1",
    "totalTasks": 214,
    "trialsPerTask": 5
  },
  "agent": {
    "id": "deepseek-eliza",
    "name": "DeepSeek V4 · ElizaOS",
    "scaffold": "ElizaOS",
    "model": "deepseek-v4",
    "class": "agent",
    "openSource": true
  },
  "run": {
    "completedAt": "2026-06-15",
    "harnessVersion": "2.1.3",
    "harnessBuild": "sha256:8c1e6a0d3f4b2a97c5e18d640b9f2a7d31c8e5f0a6b4d2c9871e3f5a0b6c4d28",
    "envPinsDigest": "sha256:94e2a32324ffd00a57f02c4ff60ee50ad3f14892790cdf6d8b14190765d44cea"
  },
  "results": {
    "categories": {
      "execution": {
        "passAt1": 58.125
      },
      "swaps": {
        "passAt1": 55.7143
      },
      "bridging": {
        "passAt1": 44.1667
      },
      "defi": {
        "passAt1": 52
      },
      "research": {
        "passAt1": 61.5385
      },
      "security": {
        "passAt1": 47.1429
      },
      "analysis": {
        "passAt1": 57.6923
      },
      "governance": {
        "passAt1": 43
      }
    },
    "metrics": {
      "passHat5": 35.0467,
      "svrPer100": 6.5421,
      "gasOverspendPct": 5.4,
      "costPerTaskUsd": 0.34,
      "medianTaskSeconds": 187
    }
  },
  "submitter": {
    "name": "NEXBENCH seed program",
    "contact": "bench@nex-t1.ai",
    "github": "Nexis-AI"
  },
  "integrity": {
    "runId": "nbr1_df9faf6dacd0e45a",
    "traceRoot": "sha256:560d0e932125485d3228a8cbbed072a02356055167fb6e2796b58ccb09a4c258",
    "canaryClean": true
  },
  "provenance": {
    "kind": "seed",
    "tier": "verified",
    "verifiedBy": "Nexis Research",
    "verifiedAt": "2026-06-15"
  }
}
