{
  "schema": "nexbench.run/2.1",
  "suite": {
    "name": "NEXBENCH",
    "version": "2.1",
    "totalTasks": 214,
    "trialsPerTask": 5
  },
  "agent": {
    "id": "sonnet5-react",
    "name": "Claude Sonnet 5 · ReAct-Web3",
    "scaffold": "ReAct-Web3 (reference)",
    "model": "claude-sonnet-5",
    "class": "agent",
    "openSource": true
  },
  "run": {
    "completedAt": "2026-07-02",
    "harnessVersion": "2.1.3",
    "harnessBuild": "sha256:8c1e6a0d3f4b2a97c5e18d640b9f2a7d31c8e5f0a6b4d2c9871e3f5a0b6c4d28",
    "envPinsDigest": "sha256:94e2a32324ffd00a57f02c4ff60ee50ad3f14892790cdf6d8b14190765d44cea"
  },
  "results": {
    "categories": {
      "execution": {
        "passAt1": 63.125
      },
      "swaps": {
        "passAt1": 60
      },
      "bridging": {
        "passAt1": 52.5
      },
      "defi": {
        "passAt1": 58.6667
      },
      "research": {
        "passAt1": 70
      },
      "security": {
        "passAt1": 64.2857
      },
      "analysis": {
        "passAt1": 65.3846
      },
      "governance": {
        "passAt1": 51
      }
    },
    "metrics": {
      "passHat5": 44.8598,
      "svrPer100": 2.3364,
      "gasOverspendPct": 3.1,
      "costPerTaskUsd": 0.81,
      "medianTaskSeconds": 126
    }
  },
  "submitter": {
    "name": "Nexis Research",
    "contact": "bench@nex-t1.ai",
    "github": "Nexis-AI"
  },
  "integrity": {
    "runId": "nbr1_4193532dfae78a8b",
    "traceRoot": "sha256:aeeee5a88d0eb437039e21534fe2c72cdcb4936417666cf42cf2c7a055bf4513",
    "canaryClean": true
  },
  "provenance": {
    "kind": "reference",
    "tier": "verified",
    "verifiedBy": "Nexis Research",
    "verifiedAt": "2026-07-02"
  }
}
